{
  "$schema": "https://json-schema.org/draft/2020-12/schema",
  "$id": "https://continuous-delphi.github.io/delphi-compiler-versions/schemas/1.0.0/delphi-compiler-versions.schema.json",
  "title": "Continuous Delphi - Canonical List of Compiler Versions",
  "type": "object",
  "additionalProperties": false,
  "required": [
    "schemaVersion",
    "dataVersion",
    "versions"
  ],
  "properties": {
    "schemaVersion": {
      "type": "string",
      "description": "Schema version for this document (semantic versioning).",
      "pattern": "^\\d+\\.\\d+\\.\\d+$",
      "examples": [
        "1.0.0"
      ]
    },
    "dataVersion": {
      "type": "string",
      "description": "Dataset version for the contents of this file (semantic versioning). Independent of schemaVersion.",
      "pattern": "^\\d+\\.\\d+\\.\\d+$",
      "examples": [
        "0.3.0"
      ]
    },
    "meta": {
      "type": "object",
      "description": "Optional metadata about the dataset generation and scope.",
      "additionalProperties": true,
      "properties": {
        "generatedUtcDate": {
          "type": "string",
          "description": "UTC date (YYYY-MM-DD) when this file was generated or last updated.",
          "pattern": "^\\d{4}-\\d{2}-\\d{2}$",
          "examples": [
            "2026-03-01"
          ]
        },
        "scope": {
          "type": "object",
          "description": "Scope rules for inclusion/exclusion.",
          "additionalProperties": true
        }
      }
    },
    "versions": {
      "type": "array",
      "description": "Ordered list of Delphi compiler version entries.",
      "minItems": 1,
      "items": {
        "$ref": "#/$defs/versionEntry"
      }
    }
  },
  "$defs": {
    "buildSystem": {
      "type": "string",
      "enum": ["DCC", "MSBuild"],
      "description": "A supported build system identifier."
    },
    "platform": {
      "type": "string",
      "enum": [
        "Win32",
        "Win64",
        "macOS32",
        "macOS64",
        "macOSARM64",
        "Linux64",
        "iOS32",
        "iOS64",
        "iOSSimulator32",
        "iOSSimulator64",
        "Android32",
        "Android64"
      ],
      "description": "A supported target platform identifier."
    },
    "versionEntry": {
      "type": "object",
      "additionalProperties": false,
      "required": [
        "verDefine",
        "productName",
        "aliases",
        "compilerVersion",
        "supportedBuildSystems",
        "supportedPlatforms"
      ],
      "properties": {
        "verDefine": {
          "type": "string",
          "description": "Canonical Delphi compiler conditional define symbol.",
          "pattern": "^VER\\d+$",
          "examples": [
            "VER370"
          ]
        },
        "compilerVersion": {
          "type": "string",
          "description": "CompilerVersion value preserving original notation (e.g., \"37.0\"). Stored as string to retain the decimal form exactly as Embarcadero defines it.",
          "pattern": "^\\d+\\.\\d+$",
          "examples": [
            "37.0"
          ]
        },
        "productName": {
          "type": "string",
          "description": "Official product name for this Delphi release.",
          "minLength": 1,
          "examples": [
            "Delphi 13 Florence"
          ]
        },
        "packageVersion": {
          "type": [
            "string",
            "null"
          ],
          "description": "Package version identifier.",
          "examples": [
            "370"
          ]
        },
        "regKeyRelativePath": {
          "type": [
            "string",
            "null"
          ],
          "description": "Relative registry key path beneath HKCU or HKLM.",
          "examples": [
            "\\Software\\Embarcadero\\BDS\\37.0"
          ]
        },
        "supportedBuildSystems": {
          "type": "array",
          "description": "Build systems supported by this version. DCC = direct command-line compiler invocation. MSBuild = .dproj-based builds via MSBuild. Represents the union of all support across all point releases within this version family.",
          "minItems": 1,
          "items": {
            "$ref": "#/$defs/buildSystem"
          },
          "examples": [
            ["DCC", "MSBuild"]
          ]
        },
        "supportedPlatforms": {
          "type": "array",
          "description": "Target platforms supported by this version family. Represents the union of all platforms supported across all point releases. See notes for any sub-version platform introductions.",
          "minItems": 1,
          "items": {
            "$ref": "#/$defs/platform"
          },
          "examples": [
            ["Win32", "Win64", "macOS64", "macOSARM64", "iOS64", "Android32", "Android64", "Linux64"]
          ]
        },
        "aliases": {
          "type": "array",
          "description": "Identifiers that resolve to this entry. The properties verDefine and productName are automatically used as aliases.",
          "minItems": 1,
          "items": {
            "type": "string"
          },
          "examples": [
            [
              "Delphi 13",
              "Delphi13",
              "BDS 37.0",
              "CompilerVersion 37.0"
            ]
          ]
        },
        "notes": {
          "type": "array",
          "description": "Optional notes for special cases, including sub-version platform introductions.",
          "items": {
            "type": "string"
          },
          "default": []
        }
      }
    }
  },
  "examples": [
    {
      "schemaVersion": "1.0.0",
      "dataVersion": "0.3.0",
      "versions": [
        {
          "verDefine": "VER370",
          "compilerVersion": "37.0",
          "productName": "Delphi 13 Florence",
          "packageVersion": "370",
          "regKeyRelativePath": "\\Software\\Embarcadero\\BDS\\37.0",
          "supportedBuildSystems": ["DCC", "MSBuild"],
          "supportedPlatforms": ["Win32", "Win64", "macOS64", "macOSARM64", "iOS64", "iOSSimulator64", "Android32", "Android64", "Linux64"],
          "aliases": [
            "Delphi 13",
            "BDS 37.0",
            "CompilerVersion 37.0"
          ],
          "notes": [
            "RAD Studio 13 unifies internal version numbers to 37 (registry, RTL, packages)."
          ]
        }
      ]
    }
  ]
}
