{
  "schemaVersion": "1.0.0",
  "dataVersion": "1.0.0",
  "meta": { "generatedUtcDate": "2026-03-01" },
  "versions": [
    {
      "verDefine": "VER180",
      "compilerVersion": "18.0",
      "productName": "Delphi 2006",
      "packageVersion": "200",
      "regKeyRelativePath": "\\Software\\Borland\\BDS\\4.0",
      "supportedBuildSystems": [],
      "supportedPlatforms": ["Win32"],
      "aliases": []
    },
    {
      "verDefine": "VER185",
      "compilerVersion": "18.5",
      "productName": "Delphi 2007",
      "packageVersion": "210",
      "regKeyRelativePath": "\\Software\\Borland\\BDS\\5.0",
      "supportedBuildSystems": [],
      "supportedPlatforms": ["Win32"],
      "aliases": []
    }
  ]
}
